Question|Reponse|Questions_Lem|CountVectorizer|TfidfVectorizer
['quel', 'rythm', 'apprentissag']|2 jours en entreprise et 3 jours à l’école, le temps des vacances scolaires se passe aussi en entreprise.|['quel rythm apprentissag']|[0, 0, 0, 0, 0, 0, 0, 1, 0, 0, 0, 0, 0, 0, 0, 0, 0, 0, 0, 0, 0, 0, 0, 0, 0, 0, 0, 0, 0, 0, 0, 0, 0, 0, 0, 0, 0, 0, 0, 0, 0, 0, 0, 0, 0, 0, 0, 0, 0, 0, 0, 0, 0, 0, 0, 0, 0, 0, 0, 0, 0, 1, 0, 0, 0, 0, 0, 0, 1, 0, 0, 0, 0, 0, 0, 0, 0]|[0.0, 0.0, 0.0, 0.0, 0.0, 0.0, 0.0, 0.5678810589734846, 0.0, 0.0, 0.0, 0.0, 0.0, 0.0, 0.0, 0.0, 0.0, 0.0, 0.0, 0.0, 0.0, 0.0, 0.0, 0.0, 0.0, 0.0, 0.0, 0.0, 0.0, 0.0, 0.0, 0.0, 0.0, 0.0, 0.0, 0.0, 0.0, 0.0, 0.0, 0.0, 0.0, 0.0, 0.0, 0.0, 0.0, 0.0, 0.0, 0.0, 0.0, 0.0, 0.0, 0.0, 0.0, 0.0, 0.0, 0.0, 0.0, 0.0, 0.0, 0.0, 0.0, 0.515523558378981, 0.0, 0.0, 0.0, 0.0, 0.0, 0.0, 0.6416748114235332, 0.0, 0.0, 0.0, 0.0, 0.0, 0.0, 0.0, 0.0]
['peut', 'fair', 'comm', 'mission', 'entrepris', 'apre', 'an', 'cycl', 'preparatoir', 'esilv']|Tout dépend de la cohérence de la mission à laquelle tu postules vis-à-vis de la majeure que tu comptes suivre (Si tu comptes poursuivre dans la cybersécurité ou la data, il te faut une mission s’y rapportant). |['peut fair comm mission entrepris apre an cycl preparatoir esilv']|[0, 0, 0, 0, 0, 1, 0, 0, 1, 0, 0, 0, 0, 0, 1, 0, 0, 0, 0, 0, 0, 0, 1, 0, 0, 0, 0, 0, 0, 0, 0, 0, 0, 0, 1, 1, 0, 0, 0, 0, 1, 0, 0, 0, 0, 0, 0, 0, 1, 0, 0, 0, 1, 0, 0, 0, 0, 0, 0, 1, 0, 0, 0, 0, 0, 0, 0, 0, 0, 0, 0, 0, 0, 0, 0, 0, 0]|[0.0, 0.0, 0.0, 0.0, 0.0, 0.33515228373841827, 0.0, 0.0, 0.2966091709046857, 0.0, 0.0, 0.0, 0.0, 0.0, 0.33515228373841827, 0.0, 0.0, 0.0, 0.0, 0.0, 0.0, 0.0, 0.33515228373841827, 0.0, 0.0, 0.0, 0.0, 0.0, 0.0, 0.0, 0.0, 0.0, 0.0, 0.0, 0.23071928431158675, 0.33515228373841827, 0.0, 0.0, 0.0, 0.0, 0.33515228373841827, 0.0, 0.0, 0.0, 0.0, 0.0, 0.0, 0.0, 0.33515228373841827, 0.0, 0.0, 0.0, 0.2692623971453193, 0.0, 0.0, 0.0, 0.0, 0.0, 0.0, 0.33515228373841827, 0.0, 0.0, 0.0, 0.0, 0.0, 0.0, 0.0, 0.0, 0.0, 0.0, 0.0, 0.0, 0.0, 0.0, 0.0, 0.0, 0.0]
['liaison', 'entre', 'ecol', 'entrepris']|Oui, il y a la Direction des partenariats entreprises qui assure la liaison entre les deux, les alternants ont aussi un tuteur école chargé de s’assurer que tout se passe bien pour l’alternant, de l’évaluer au cours de l’année ainsi qu’un tuteur entreprise qui prend en charge l’alternant pendant son temps passé en entreprise.  |['liaison entre ecol entrepris']|[0, 0, 0, 0, 0, 0, 0, 0, 0, 0, 0, 0, 0, 0, 0, 0, 0, 0, 0, 0, 0, 0, 0, 0, 0, 0, 0, 0, 0, 0, 1, 0, 0, 1, 1, 0, 0, 0, 0, 0, 0, 0, 0, 0, 1, 0, 0, 0, 0, 0, 0, 0, 0, 0, 0, 0, 0, 0, 0, 0, 0, 0, 0, 0, 0, 0, 0, 0, 0, 0, 0, 0, 0, 0, 0, 0, 0]|[0.0, 0.0, 0.0, 0.0, 0.0, 0.0, 0.0, 0.0, 0.0, 0.0, 0.0, 0.0, 0.0, 0.0, 0.0, 0.0, 0.0, 0.0, 0.0, 0.0, 0.0, 0.0, 0.0, 0.0, 0.0, 0.0, 0.0, 0.0, 0.0, 0.0, 0.49037196029347785, 0.0, 0.0, 0.5540937317358171, 0.38143887250788217, 0.0, 0.0, 0.0, 0.0, 0.0, 0.0, 0.0, 0.0, 0.0, 0.5540937317358171, 0.0, 0.0, 0.0, 0.0, 0.0, 0.0, 0.0, 0.0, 0.0, 0.0, 0.0, 0.0, 0.0, 0.0, 0.0, 0.0, 0.0, 0.0, 0.0, 0.0, 0.0, 0.0, 0.0, 0.0, 0.0, 0.0, 0.0, 0.0, 0.0, 0.0, 0.0, 0.0]
['aid', 'recherch', 'entrepris']|L’école met en relation des entreprises qui ont des postes en alternance à pourvoir et des étudiants en recherche d’alternance via des rencontres qui peuvent se faire en présentiel où à distance. Il y a donc une aide de l’école bien qu’il faille rester actif dans cette démarche et poursuivre les recherches par soi-même. |['aid recherch entrepris']|[0, 0, 1, 0, 0, 0, 0, 0, 0, 0, 0, 0, 0, 0, 0, 0, 0, 0, 0, 0, 0, 0, 0, 0, 0, 0, 0, 0, 0, 0, 0, 0, 0, 0, 1, 0, 0, 0, 0, 0, 0, 0, 0, 0, 0, 0, 0, 0, 0, 0, 0, 0, 0, 0, 0, 0, 0, 0, 0, 0, 0, 0, 0, 0, 0, 1, 0, 0, 0, 0, 0, 0, 0, 0, 0, 0, 0]|[0.0, 0.0, 0.6357834873181182, 0.0, 0.0, 0.0, 0.0, 0.0, 0.0, 0.0, 0.0, 0.0, 0.0, 0.0, 0.0, 0.0, 0.0, 0.0, 0.0, 0.0, 0.0, 0.0, 0.0, 0.0, 0.0, 0.0, 0.0, 0.0, 0.0, 0.0, 0.0, 0.0, 0.0, 0.0, 0.4376742104662148, 0.0, 0.0, 0.0, 0.0, 0.0, 0.0, 0.0, 0.0, 0.0, 0.0, 0.0, 0.0, 0.0, 0.0, 0.0, 0.0, 0.0, 0.0, 0.0, 0.0, 0.0, 0.0, 0.0, 0.0, 0.0, 0.0, 0.0, 0.0, 0.0, 0.0, 0.6357834873181182, 0.0, 0.0, 0.0, 0.0, 0.0, 0.0, 0.0, 0.0, 0.0, 0.0, 0.0]
['devon', 'rest', 'mem', 'entrepris', 'pend', 'anne', 'apprentissag']|Sauf pour des raisons exceptionnelles qui impliquent une volonté de la part de l’entreprise ou de l’alternant de vouloir rompre le contrat qui lie l’étudiant à l’entreprise, l’étudiant est considéré comme salarié de l’entreprise durant toute la durée de la formation. Si un contrat est signé pour 3 ans d’apprentissage, l’étudiant sera donc normalement 3 ans dans la même entreprise. A savoir qu’il est également possible de rejoindre le parcours en alternance lors de la 4eme année, pour un contrat de 2 ans. |['devon rest mem entrepris pend anne apprentissag']|[0, 0, 0, 0, 0, 0, 1, 1, 0, 0, 0, 0, 0, 0, 0, 0, 0, 0, 0, 0, 0, 0, 0, 0, 1, 0, 0, 0, 0, 0, 0, 0, 0, 0, 1, 0, 0, 0, 0, 0, 0, 0, 0, 0, 0, 0, 1, 0, 0, 0, 0, 1, 0, 0, 0, 0, 0, 0, 0, 0, 0, 0, 0, 0, 0, 0, 0, 1, 0, 0, 0, 0, 0, 0, 0, 0, 0]|[0.0, 0.0, 0.0, 0.0, 0.0, 0.0, 0.3711476618737589, 0.3711476618737589, 0.0, 0.0, 0.0, 0.0, 0.0, 0.0, 0.0, 0.0, 0.0, 0.0, 0.0, 0.0, 0.0, 0.0, 0.0, 0.0, 0.41937673775143375, 0.0, 0.0, 0.0, 0.0, 0.0, 0.0, 0.0, 0.0, 0.0, 0.2886995120894278, 0.0, 0.0, 0.0, 0.0, 0.0, 0.0, 0.0, 0.0, 0.0, 0.0, 0.0, 0.3369285879671026, 0.0, 0.0, 0.0, 0.0, 0.41937673775143375, 0.0, 0.0, 0.0, 0.0, 0.0, 0.0, 0.0, 0.0, 0.0, 0.0, 0.0, 0.0, 0.0, 0.0, 0.0, 0.41937673775143375, 0.0, 0.0, 0.0, 0.0, 0.0, 0.0, 0.0, 0.0, 0.0]
['semestr', 'etrang']|En alternance, le diplôme obtenu à la fin de la formation est le même que celui obtenu par les étudiants qui ne sont pas en alternance (dits en « initial »). Il y a donc également une mobilité à l’international à valider pour les étudiants en alternance mais celle-ci est plus courte. La durée de la période à l’étranger est actuellement de 3 mois. Elle peut être organisée par l’école ou par l’entreprise. |['semestr etrang']|[0, 0, 0, 0, 0, 0, 0, 0, 0, 0, 0, 0, 0, 0, 0, 0, 0, 0, 0, 0, 0, 0, 0, 0, 0, 0, 0, 0, 0, 0, 0, 0, 0, 0, 0, 0, 1, 0, 0, 0, 0, 0, 0, 0, 0, 0, 0, 0, 0, 0, 0, 0, 0, 0, 0, 0, 0, 0, 0, 0, 0, 0, 0, 0, 0, 0, 0, 0, 0, 0, 1, 0, 0, 0, 0, 0, 0]|[0.0, 0.0, 0.0, 0.0, 0.0, 0.0, 0.0, 0.0, 0.0, 0.0, 0.0, 0.0, 0.0, 0.0, 0.0, 0.0, 0.0, 0.0, 0.0, 0.0, 0.0, 0.0, 0.0, 0.0, 0.0, 0.0, 0.0, 0.0, 0.0, 0.0, 0.0, 0.0, 0.0, 0.0, 0.0, 0.0, 0.6415209094436062, 0.0, 0.0, 0.0, 0.0, 0.0, 0.0, 0.0, 0.0, 0.0, 0.0, 0.0, 0.0, 0.0, 0.0, 0.0, 0.0, 0.0, 0.0, 0.0, 0.0, 0.0, 0.0, 0.0, 0.0, 0.0, 0.0, 0.0, 0.0, 0.0, 0.0, 0.0, 0.0, 0.0, 0.7671055486350288, 0.0, 0.0, 0.0, 0.0, 0.0, 0.0]
['echang', 'etrang', 'autoris']|En alternance, le diplôme obtenu à la fin de la formation est le même que celui obtenu par les étudiants qui ne sont pas en alternance (dits en « initial »). Il y a donc également une mobilité à l’international à valider pour les étudiants en alternance mais celle-ci est plus courte. La durée de la période à l’étranger est actuellement de 3 mois. Elle peut être organisée par l’école ou par l’entreprise. |['echang etrang autoris']|[0, 0, 0, 0, 0, 0, 0, 0, 0, 1, 0, 0, 0, 0, 0, 0, 0, 0, 0, 0, 0, 0, 0, 0, 0, 0, 0, 0, 0, 1, 0, 0, 0, 0, 0, 0, 1, 0, 0, 0, 0, 0, 0, 0, 0, 0, 0, 0, 0, 0, 0, 0, 0, 0, 0, 0, 0, 0, 0, 0, 0, 0, 0, 0, 0, 0, 0, 0, 0, 0, 0, 0, 0, 0, 0, 0, 0]|[0.0, 0.0, 0.0, 0.0, 0.0, 0.0, 0.0, 0.0, 0.0, 0.6264986123092073, 0.0, 0.0, 0.0, 0.0, 0.0, 0.0, 0.0, 0.0, 0.0, 0.0, 0.0, 0.0, 0.0, 0.0, 0.0, 0.0, 0.0, 0.0, 0.0, 0.6264986123092073, 0.0, 0.0, 0.0, 0.0, 0.0, 0.0, 0.46367982223650306, 0.0, 0.0, 0.0, 0.0, 0.0, 0.0, 0.0, 0.0, 0.0, 0.0, 0.0, 0.0, 0.0, 0.0, 0.0, 0.0, 0.0, 0.0, 0.0, 0.0, 0.0, 0.0, 0.0, 0.0, 0.0, 0.0, 0.0, 0.0, 0.0, 0.0, 0.0, 0.0, 0.0, 0.0, 0.0, 0.0, 0.0, 0.0, 0.0, 0.0]
['peut', 'toujour', 'effectu', 'semestr', 'etrang']|En alternance, le diplôme obtenu à la fin de la formation est le même que celui obtenu par les étudiants qui ne sont pas en alternance (dits en « initial »). Il y a donc également une mobilité à l’international à valider pour les étudiants en alternance mais celle-ci est plus courte. La durée de la période à l’étranger est actuellement de 3 mois. Elle peut être organisée par l’école ou par l’entreprise. |['peut toujour effectu semestr etrang']|[0, 0, 0, 0, 0, 0, 0, 0, 0, 0, 0, 0, 0, 0, 0, 0, 0, 0, 0, 0, 0, 0, 0, 0, 0, 0, 0, 0, 0, 0, 0, 1, 0, 0, 0, 0, 1, 0, 0, 0, 0, 0, 0, 0, 0, 0, 0, 0, 0, 0, 0, 0, 1, 0, 0, 0, 0, 0, 0, 0, 0, 0, 0, 0, 0, 0, 0, 0, 0, 0, 1, 0, 0, 0, 1, 0, 0]|[0.0, 0.0, 0.0, 0.0, 0.0, 0.0, 0.0, 0.0, 0.0, 0.0, 0.0, 0.0, 0.0, 0.0, 0.0, 0.0, 0.0, 0.0, 0.0, 0.0, 0.0, 0.0, 0.0, 0.0, 0.0, 0.0, 0.0, 0.0, 0.0, 0.0, 0.0, 0.5014786700105359, 0.0, 0.0, 0.0, 0.0, 0.37115092674957223, 0.0, 0.0, 0.0, 0.0, 0.0, 0.0, 0.0, 0.0, 0.0, 0.0, 0.0, 0.0, 0.0, 0.0, 0.0, 0.40288953814699946, 0.0, 0.0, 0.0, 0.0, 0.0, 0.0, 0.0, 0.0, 0.0, 0.0, 0.0, 0.0, 0.0, 0.0, 0.0, 0.0, 0.0, 0.44380772489171383, 0.0, 0.0, 0.0, 0.5014786700105359, 0.0, 0.0]
['compatibl', 'voyag', 'etrang']|En alternance, le diplôme obtenu à la fin de la formation est le même que celui obtenu par les étudiants qui ne sont pas en alternance (dits en « initial »). Il y a donc également une mobilité à l’international à valider pour les étudiants en alternance mais celle-ci est plus courte. La durée de la période à l’étranger est actuellement de 3 mois. Elle peut être organisée par l’école ou par l’entreprise. |['compatibl voyag etrang']|[0, 0, 0, 0, 0, 0, 0, 0, 0, 0, 0, 0, 0, 0, 0, 0, 1, 0, 0, 0, 0, 0, 0, 0, 0, 0, 0, 0, 0, 0, 0, 0, 0, 0, 0, 0, 1, 0, 0, 0, 0, 0, 0, 0, 0, 0, 0, 0, 0, 0, 0, 0, 0, 0, 0, 0, 0, 0, 0, 0, 0, 0, 0, 0, 0, 0, 0, 0, 0, 0, 0, 0, 0, 0, 0, 0, 1]|[0.0, 0.0, 0.0, 0.0, 0.0, 0.0, 0.0, 0.0, 0.0, 0.0, 0.0, 0.0, 0.0, 0.0, 0.0, 0.0, 0.6264986123092073, 0.0, 0.0, 0.0, 0.0, 0.0, 0.0, 0.0, 0.0, 0.0, 0.0, 0.0, 0.0, 0.0, 0.0, 0.0, 0.0, 0.0, 0.0, 0.0, 0.46367982223650306, 0.0, 0.0, 0.0, 0.0, 0.0, 0.0, 0.0, 0.0, 0.0, 0.0, 0.0, 0.0, 0.0, 0.0, 0.0, 0.0, 0.0, 0.0, 0.0, 0.0, 0.0, 0.0, 0.0, 0.0, 0.0, 0.0, 0.0, 0.0, 0.0, 0.0, 0.0, 0.0, 0.0, 0.0, 0.0, 0.0, 0.0, 0.0, 0.0, 0.6264986123092073]
['diplom', 'fin', 'exact', 'mem']|Oui, à l’issue de la formation, les alternants reçoivent le même diplôme d’ingénieur habilité par la CTI (Commission des Titres d’Ingénieurs) que les étudiants ayant suivi d’autres parcours.  |['diplom fin exact mem']|[0, 0, 0, 0, 0, 0, 0, 0, 0, 0, 0, 0, 0, 0, 0, 0, 0, 0, 0, 0, 0, 0, 0, 0, 0, 1, 0, 0, 0, 0, 0, 0, 0, 0, 0, 0, 0, 0, 1, 0, 0, 0, 1, 0, 0, 0, 1, 0, 0, 0, 0, 0, 0, 0, 0, 0, 0, 0, 0, 0, 0, 0, 0, 0, 0, 0, 0, 0, 0, 0, 0, 0, 0, 0, 0, 0, 0]|[0.0, 0.0, 0.0, 0.0, 0.0, 0.0, 0.0, 0.0, 0.0, 0.0, 0.0, 0.0, 0.0, 0.0, 0.0, 0.0, 0.0, 0.0, 0.0, 0.0, 0.0, 0.0, 0.0, 0.0, 0.0, 0.4779462009575411, 0.0, 0.0, 0.0, 0.0, 0.0, 0.0, 0.0, 0.0, 0.0, 0.0, 0.0, 0.0, 0.540053297295031, 0.0, 0.0, 0.0, 0.540053297295031, 0.0, 0.0, 0.0, 0.43388051483303947, 0.0, 0.0, 0.0, 0.0, 0.0, 0.0, 0.0, 0.0, 0.0, 0.0, 0.0, 0.0, 0.0, 0.0, 0.0, 0.0, 0.0, 0.0, 0.0, 0.0, 0.0, 0.0, 0.0, 0.0, 0.0, 0.0, 0.0, 0.0, 0.0, 0.0]
['quelconqu', 'desavantag', 'altern']|Une fois en alternance, l’étudiant est considéré comme salarié de l’entreprise pour la durée de sa formation, il n’y a donc plus de vacances scolaires. Les vacances sont définies par des congés payés acquis pendant l’année comme les autres salariés (5 semaines). |['quelconqu desavantag altern']|[0, 0, 0, 1, 0, 0, 0, 0, 0, 0, 0, 0, 0, 0, 0, 0, 0, 0, 0, 0, 0, 0, 0, 1, 0, 0, 0, 0, 0, 0, 0, 0, 0, 0, 0, 0, 0, 0, 0, 0, 0, 0, 0, 0, 0, 0, 0, 0, 0, 0, 0, 0, 0, 0, 0, 0, 0, 0, 0, 0, 0, 0, 1, 0, 0, 0, 0, 0, 0, 0, 0, 0, 0, 0, 0, 0, 0]|[0.0, 0.0, 0.0, 0.3430473872708605, 0.0, 0.0, 0.0, 0.0, 0.0, 0.0, 0.0, 0.0, 0.0, 0.0, 0.0, 0.0, 0.0, 0.0, 0.0, 0.0, 0.0, 0.0, 0.0, 0.6641981971093555, 0.0, 0.0, 0.0, 0.0, 0.0, 0.0, 0.0, 0.0, 0.0, 0.0, 0.0, 0.0, 0.0, 0.0, 0.0, 0.0, 0.0, 0.0, 0.0, 0.0, 0.0, 0.0, 0.0, 0.0, 0.0, 0.0, 0.0, 0.0, 0.0, 0.0, 0.0, 0.0, 0.0, 0.0, 0.0, 0.0, 0.0, 0.0, 0.6641981971093555, 0.0, 0.0, 0.0, 0.0, 0.0, 0.0, 0.0, 0.0, 0.0, 0.0, 0.0, 0.0, 0.0, 0.0]
['altern', 'ferm', 'port', 'doubl', 'diplom']|Oui, on ne peut pas être alternant et être en double diplôme.  |['altern ferm port doubl diplom']|[0, 0, 0, 1, 0, 0, 0, 0, 0, 0, 0, 0, 0, 0, 0, 0, 0, 0, 0, 0, 0, 0, 0, 0, 0, 1, 0, 1, 0, 0, 0, 0, 0, 0, 0, 0, 0, 0, 0, 0, 0, 1, 0, 0, 0, 0, 0, 0, 0, 0, 0, 0, 0, 0, 0, 1, 0, 0, 0, 0, 0, 0, 0, 0, 0, 0, 0, 0, 0, 0, 0, 0, 0, 0, 0, 0, 0]|[0.0, 0.0, 0.0, 0.2566434265423497, 0.0, 0.0, 0.0, 0.0, 0.0, 0.0, 0.0, 0.0, 0.0, 0.0, 0.0, 0.0, 0.0, 0.0, 0.0, 0.0, 0.0, 0.0, 0.0, 0.0, 0.0, 0.43976039433002784, 0.0, 0.49690540588435944, 0.0, 0.0, 0.0, 0.0, 0.0, 0.0, 0.0, 0.0, 0.0, 0.0, 0.0, 0.0, 0.0, 0.49690540588435944, 0.0, 0.0, 0.0, 0.0, 0.0, 0.0, 0.0, 0.0, 0.0, 0.0, 0.0, 0.0, 0.0, 0.49690540588435944, 0.0, 0.0, 0.0, 0.0, 0.0, 0.0, 0.0, 0.0, 0.0, 0.0, 0.0, 0.0, 0.0, 0.0, 0.0, 0.0, 0.0, 0.0, 0.0, 0.0, 0.0]
['embauch', 'reel', 'plus', 'simpl', 'apre', 'parcour', 'altern']|Oui, l’alternance favorise l’obtention d’un premier emploi en rapport avec la spécialité du diplôme obtenu, la montée en compétence de l’alternant au sein d’un environnement professionnel et permet de sortir de l’école avec une vraie expérience professionnelle. Il est donc plus simple de trouver un CDD/CDI après une formation en alternance et le salaire est plus conséquent. Il est aussi possible qu’à la fin du contrat, l’entreprise propose un CDI à l’alternant. |['embauch reel plus simpl apre parcour altern']|[0, 0, 0, 1, 0, 0, 0, 0, 1, 0, 0, 0, 0, 0, 0, 0, 0, 0, 0, 0, 0, 0, 0, 0, 0, 0, 0, 0, 0, 0, 0, 0, 1, 0, 0, 0, 0, 0, 0, 0, 0, 0, 0, 0, 0, 0, 0, 0, 0, 0, 1, 0, 0, 0, 1, 0, 0, 0, 0, 0, 0, 0, 0, 0, 0, 0, 1, 0, 0, 0, 0, 1, 0, 0, 0, 0, 0]|[0.0, 0.0, 0.0, 0.2164178243696891, 0.0, 0.0, 0.0, 0.0, 0.37083352987868756, 0.0, 0.0, 0.0, 0.0, 0.0, 0.0, 0.0, 0.0, 0.0, 0.0, 0.0, 0.0, 0.0, 0.0, 0.0, 0.0, 0.0, 0.0, 0.0, 0.0, 0.0, 0.0, 0.0, 0.4190217856263111, 0.0, 0.0, 0.0, 0.0, 0.0, 0.0, 0.0, 0.0, 0.0, 0.0, 0.0, 0.0, 0.0, 0.0, 0.0, 0.0, 0.0, 0.336643418315217, 0.0, 0.0, 0.0, 0.4190217856263111, 0.0, 0.0, 0.0, 0.0, 0.0, 0.0, 0.0, 0.0, 0.0, 0.0, 0.0, 0.4190217856263111, 0.0, 0.0, 0.0, 0.0, 0.4190217856263111, 0.0, 0.0, 0.0, 0.0, 0.0]
['quel', 'salair', 'moyen', 'altern']|Le salaire d’un alternant est défini par une grille salariale qui est elle-même définie par l’état en fonction du type de contrat (à l’ESILV il s’agit d’un contrat d’apprentissage), de l’âge, et du nombre d’années passés en alternance, ou bien par le SMC (Salaire Minimum Conventionnel) si existant et plus favorable à l’apprenti. |['quel salair moyen altern']|[0, 0, 0, 1, 0, 0, 0, 0, 0, 0, 0, 0, 0, 0, 0, 0, 0, 0, 0, 0, 0, 0, 0, 0, 0, 0, 0, 0, 0, 0, 0, 0, 0, 0, 0, 0, 0, 0, 0, 0, 0, 0, 0, 0, 0, 0, 0, 0, 0, 1, 0, 0, 0, 0, 0, 0, 0, 0, 0, 0, 0, 1, 0, 0, 0, 0, 0, 0, 0, 1, 0, 0, 0, 0, 0, 0, 0]|[0.0, 0.0, 0.0, 0.3026529745912981, 0.0, 0.0, 0.0, 0.0, 0.0, 0.0, 0.0, 0.0, 0.0, 0.0, 0.0, 0.0, 0.0, 0.0, 0.0, 0.0, 0.0, 0.0, 0.0, 0.0, 0.0, 0.0, 0.0, 0.0, 0.0, 0.0, 0.0, 0.0, 0.0, 0.0, 0.0, 0.0, 0.0, 0.0, 0.0, 0.0, 0.0, 0.0, 0.0, 0.0, 0.0, 0.0, 0.0, 0.0, 0.0, 0.5859877309445964, 0.0, 0.0, 0.0, 0.0, 0.0, 0.0, 0.0, 0.0, 0.0, 0.0, 0.0, 0.470784383062826, 0.0, 0.0, 0.0, 0.0, 0.0, 0.0, 0.0, 0.5859877309445964, 0.0, 0.0, 0.0, 0.0, 0.0, 0.0, 0.0]
['adress', 'postul', 'altern']|Il faut s’adresser à Assia Spicher, Responsable de l'Alternance et des missions en entreprises au moment de l’ouverture des candidatures pour le parcours alternance.  |['adress postul altern']|[0, 1, 0, 1, 0, 0, 0, 0, 0, 0, 0, 0, 0, 0, 0, 0, 0, 0, 0, 0, 0, 0, 0, 0, 0, 0, 0, 0, 0, 0, 0, 0, 0, 0, 0, 0, 0, 0, 0, 0, 0, 0, 0, 0, 0, 0, 0, 0, 0, 0, 0, 0, 0, 0, 0, 0, 1, 0, 0, 0, 0, 0, 0, 0, 0, 0, 0, 0, 0, 0, 0, 0, 0, 0, 0, 0, 0]|[0.0, 0.6536384718778178, 0.0, 0.38146231289927224, 0.0, 0.0, 0.0, 0.0, 0.0, 0.0, 0.0, 0.0, 0.0, 0.0, 0.0, 0.0, 0.0, 0.0, 0.0, 0.0, 0.0, 0.0, 0.0, 0.0, 0.0, 0.0, 0.0, 0.0, 0.0, 0.0, 0.0, 0.0, 0.0, 0.0, 0.0, 0.0, 0.0, 0.0, 0.0, 0.0, 0.0, 0.0, 0.0, 0.0, 0.0, 0.0, 0.0, 0.0, 0.0, 0.0, 0.0, 0.0, 0.0, 0.0, 0.0, 0.0, 0.6536384718778178, 0.0, 0.0, 0.0, 0.0, 0.0, 0.0, 0.0, 0.0, 0.0, 0.0, 0.0, 0.0, 0.0, 0.0, 0.0, 0.0, 0.0, 0.0, 0.0, 0.0]
['adress', 'postul', 'altern']|Il faut s’adresser à Assia Spicher, Responsable de l'Alternance et des missions en entreprises au moment de l’ouverture des candidatures pour le parcours alternance.  |['adress postul altern']|[0, 1, 0, 1, 0, 0, 0, 0, 0, 0, 0, 0, 0, 0, 0, 0, 0, 0, 0, 0, 0, 0, 0, 0, 0, 0, 0, 0, 0, 0, 0, 0, 0, 0, 0, 0, 0, 0, 0, 0, 0, 0, 0, 0, 0, 0, 0, 0, 0, 0, 0, 0, 0, 0, 0, 0, 1, 0, 0, 0, 0, 0, 0, 0, 0, 0, 0, 0, 0, 0, 0, 0, 0, 0, 0, 0, 0]|[0.0, 0.6536384718778178, 0.0, 0.38146231289927224, 0.0, 0.0, 0.0, 0.0, 0.0, 0.0, 0.0, 0.0, 0.0, 0.0, 0.0, 0.0, 0.0, 0.0, 0.0, 0.0, 0.0, 0.0, 0.0, 0.0, 0.0, 0.0, 0.0, 0.0, 0.0, 0.0, 0.0, 0.0, 0.0, 0.0, 0.0, 0.0, 0.0, 0.0, 0.0, 0.0, 0.0, 0.0, 0.0, 0.0, 0.0, 0.0, 0.0, 0.0, 0.0, 0.0, 0.0, 0.0, 0.0, 0.0, 0.0, 0.0, 0.6536384718778178, 0.0, 0.0, 0.0, 0.0, 0.0, 0.0, 0.0, 0.0, 0.0, 0.0, 0.0, 0.0, 0.0, 0.0, 0.0, 0.0, 0.0, 0.0, 0.0, 0.0]
['quoi', 'consist', 'altern']|L’alternance consiste à travailler en entreprise pour apprendre un métier en relation avec ses études pendant la durée de sa formation. Une partie de la semaine est consacrée à l’école et l’autre partie à l’entreprise. L’étudiant est considéré comme salarié de l’entreprise pour la durée de sa formation, il reçoit donc un salaire et des congés payés et s’engage à accomplir les missions et objectifs qui lui sont fournis pendant son temps en entreprise tout en faisant ses études en parallèle. L’objectif étant de sortir de l’école en ayant déjà une vraie première expérience professionnelle (pas uniquement constituée de périodes de stage). Cela favorise l’insertion professionnelle et un salaire plus conséquent à la sortie.|['quoi consist altern']|[0, 0, 0, 1, 0, 0, 0, 0, 0, 0, 0, 0, 0, 0, 0, 0, 0, 0, 0, 1, 0, 0, 0, 0, 0, 0, 0, 0, 0, 0, 0, 0, 0, 0, 0, 0, 0, 0, 0, 0, 0, 0, 0, 0, 0, 0, 0, 0, 0, 0, 0, 0, 0, 0, 0, 0, 0, 0, 0, 0, 0, 0, 0, 0, 1, 0, 0, 0, 0, 0, 0, 0, 0, 0, 0, 0, 0]|[0.0, 0.0, 0.0, 0.3430473872708605, 0.0, 0.0, 0.0, 0.0, 0.0, 0.0, 0.0, 0.0, 0.0, 0.0, 0.0, 0.0, 0.0, 0.0, 0.0, 0.6641981971093555, 0.0, 0.0, 0.0, 0.0, 0.0, 0.0, 0.0, 0.0, 0.0, 0.0, 0.0, 0.0, 0.0, 0.0, 0.0, 0.0, 0.0, 0.0, 0.0, 0.0, 0.0, 0.0, 0.0, 0.0, 0.0, 0.0, 0.0, 0.0, 0.0, 0.0, 0.0, 0.0, 0.0, 0.0, 0.0, 0.0, 0.0, 0.0, 0.0, 0.0, 0.0, 0.0, 0.0, 0.0, 0.6641981971093555, 0.0, 0.0, 0.0, 0.0, 0.0, 0.0, 0.0, 0.0, 0.0, 0.0, 0.0, 0.0]
['concern', 'altern']|Les étudiants en 2nd et 3ème année à l’ESILV pour s’engager sur une formation en alternance de 3 ou 2 ans respectivement.|['concern altern']|[0, 0, 0, 1, 0, 0, 0, 0, 0, 0, 0, 0, 0, 0, 0, 0, 0, 1, 0, 0, 0, 0, 0, 0, 0, 0, 0, 0, 0, 0, 0, 0, 0, 0, 0, 0, 0, 0, 0, 0, 0, 0, 0, 0, 0, 0, 0, 0, 0, 0, 0, 0, 0, 0, 0, 0, 0, 0, 0, 0, 0, 0, 0, 0, 0, 0, 0, 0, 0, 0, 0, 0, 0, 0, 0, 0, 0]|[0.0, 0.0, 0.0, 0.4588915710774475, 0.0, 0.0, 0.0, 0.0, 0.0, 0.0, 0.0, 0.0, 0.0, 0.0, 0.0, 0.0, 0.0, 0.8884922768342288, 0.0, 0.0, 0.0, 0.0, 0.0, 0.0, 0.0, 0.0, 0.0, 0.0, 0.0, 0.0, 0.0, 0.0, 0.0, 0.0, 0.0, 0.0, 0.0, 0.0, 0.0, 0.0, 0.0, 0.0, 0.0, 0.0, 0.0, 0.0, 0.0, 0.0, 0.0, 0.0, 0.0, 0.0, 0.0, 0.0, 0.0, 0.0, 0.0, 0.0, 0.0, 0.0, 0.0, 0.0, 0.0, 0.0, 0.0, 0.0, 0.0, 0.0, 0.0, 0.0, 0.0, 0.0, 0.0, 0.0, 0.0, 0.0, 0.0]
['peut', 'pretendr', 'altern', 'integr', 'ecol', 'concour', 'prep', 'bt', 'dut', 'fac', 'licenc']|Oui, l’accès à l’alternance n’est pas conditionné au moyen de recrutement de l’école.|['peut pretendr altern integr ecol concour prep bt dut fac licenc']|[0, 0, 0, 1, 0, 0, 0, 0, 0, 0, 1, 0, 0, 0, 0, 0, 0, 0, 1, 0, 0, 0, 0, 0, 0, 0, 0, 0, 1, 0, 1, 0, 0, 0, 0, 0, 0, 0, 0, 1, 0, 0, 0, 1, 0, 1, 0, 0, 0, 0, 0, 0, 1, 0, 0, 0, 0, 1, 0, 0, 1, 0, 0, 0, 0, 0, 0, 0, 0, 0, 0, 0, 0, 0, 0, 0, 0]|[0.0, 0.0, 0.0, 0.16587189459408117, 0.0, 0.0, 0.0, 0.0, 0.0, 0.0, 0.32115625254278124, 0.0, 0.0, 0.0, 0.0, 0.0, 0.0, 0.0, 0.32115625254278124, 0.0, 0.0, 0.0, 0.0, 0.0, 0.0, 0.0, 0.0, 0.0, 0.32115625254278124, 0.0, 0.28422270836118685, 0.0, 0.0, 0.0, 0.0, 0.0, 0.0, 0.0, 0.0, 0.32115625254278124, 0.0, 0.0, 0.0, 0.32115625254278124, 0.0, 0.32115625254278124, 0.0, 0.0, 0.0, 0.0, 0.0, 0.0, 0.25801794173471787, 0.0, 0.0, 0.0, 0.0, 0.32115625254278124, 0.0, 0.0, 0.32115625254278124, 0.0, 0.0, 0.0, 0.0, 0.0, 0.0, 0.0, 0.0, 0.0, 0.0, 0.0, 0.0, 0.0, 0.0, 0.0, 0.0]
['comment', 'prepar', 'mieux', 'amont', 'parcour']|Être pro-actif en ce qui concerne l’apprentissage de nouvelles compétences, ne pas attendre que le sujet soit abordé en cours ou lors d’un module, savoir s’organiser car en alternance les vacances sont moindres par rapport aux autres parcours et il faut aussi passer des partiels/examens (ou rendre des projets), le temps disponible doit donc être correctement utilisé pour ne pas être débordé.|['comment prepar mieux amont parcour']|[0, 0, 0, 0, 1, 0, 0, 0, 0, 0, 0, 0, 0, 0, 0, 1, 0, 0, 0, 0, 0, 0, 0, 0, 0, 0, 0, 0, 0, 0, 0, 0, 0, 0, 0, 0, 0, 0, 0, 0, 0, 0, 0, 0, 0, 0, 0, 1, 0, 0, 1, 0, 0, 0, 0, 0, 0, 0, 1, 0, 0, 0, 0, 0, 0, 0, 0, 0, 0, 0, 0, 0, 0, 0, 0, 0, 0]|[0.0, 0.0, 0.0, 0.0, 0.47518522242310035, 0.0, 0.0, 0.0, 0.0, 0.0, 0.0, 0.0, 0.0, 0.0, 0.0, 0.42053807086416733, 0.0, 0.0, 0.0, 0.0, 0.0, 0.0, 0.0, 0.0, 0.0, 0.0, 0.0, 0.0, 0.0, 0.0, 0.0, 0.0, 0.0, 0.0, 0.0, 0.0, 0.0, 0.0, 0.0, 0.0, 0.0, 0.0, 0.0, 0.0, 0.0, 0.0, 0.0, 0.47518522242310035, 0.0, 0.0, 0.3817652997929102, 0.0, 0.0, 0.0, 0.0, 0.0, 0.0, 0.0, 0.47518522242310035, 0.0, 0.0, 0.0, 0.0, 0.0, 0.0, 0.0, 0.0, 0.0, 0.0, 0.0, 0.0, 0.0, 0.0, 0.0, 0.0, 0.0, 0.0]
['comment', 'trouv', 'entrepris', 'quelqu', 'tip']|Lors de rencontres organisées par l’école, en répondant à des offres ou à l’aide de son réseau.|['comment trouv entrepris quelqu tip']|[0, 0, 0, 0, 0, 0, 0, 0, 0, 0, 0, 0, 0, 0, 0, 1, 0, 0, 0, 0, 0, 0, 0, 0, 0, 0, 0, 0, 0, 0, 0, 0, 0, 0, 1, 0, 0, 0, 0, 0, 0, 0, 0, 0, 0, 0, 0, 0, 0, 0, 0, 0, 0, 0, 0, 0, 0, 0, 0, 0, 0, 0, 0, 1, 0, 0, 0, 0, 0, 0, 0, 0, 0, 1, 0, 1, 0]|[0.0, 0.0, 0.0, 0.0, 0.0, 0.0, 0.0, 0.0, 0.0, 0.0, 0.0, 0.0, 0.0, 0.0, 0.0, 0.42892813593774637, 0.0, 0.0, 0.0, 0.0, 0.0, 0.0, 0.0, 0.0, 0.0, 0.0, 0.0, 0.0, 0.0, 0.0, 0.0, 0.0, 0.0, 0.0, 0.3336444124192671, 0.0, 0.0, 0.0, 0.0, 0.0, 0.0, 0.0, 0.0, 0.0, 0.0, 0.0, 0.0, 0.0, 0.0, 0.0, 0.0, 0.0, 0.0, 0.0, 0.0, 0.0, 0.0, 0.0, 0.0, 0.0, 0.0, 0.0, 0.0, 0.48466554112513927, 0.0, 0.0, 0.0, 0.0, 0.0, 0.0, 0.0, 0.0, 0.0, 0.48466554112513927, 0.0, 0.48466554112513927, 0.0]
['combien', 'plac', 'disponibl', 'chaqu', 'anne']|L'école publie chaque année le nombre de places disponibles pour chaque majeure|['combien plac disponibl chaqu anne']|[0, 0, 0, 0, 0, 0, 1, 0, 0, 0, 0, 1, 0, 1, 0, 0, 0, 0, 0, 0, 0, 0, 0, 0, 0, 0, 1, 0, 0, 0, 0, 0, 0, 0, 0, 0, 0, 0, 0, 0, 0, 0, 0, 0, 0, 0, 0, 0, 0, 0, 0, 0, 0, 1, 0, 0, 0, 0, 0, 0, 0, 0, 0, 0, 0, 0, 0, 0, 0, 0, 0, 0, 0, 0, 0, 0, 0]|[0.0, 0.0, 0.0, 0.0, 0.0, 0.0, 0.40465240939935776, 0.0, 0.0, 0.0, 0.0, 0.45723528614032366, 0.0, 0.45723528614032366, 0.0, 0.0, 0.0, 0.0, 0.0, 0.0, 0.0, 0.0, 0.0, 0.0, 0.0, 0.0, 0.45723528614032366, 0.0, 0.0, 0.0, 0.0, 0.0, 0.0, 0.0, 0.0, 0.0, 0.0, 0.0, 0.0, 0.0, 0.0, 0.0, 0.0, 0.0, 0.0, 0.0, 0.0, 0.0, 0.0, 0.0, 0.0, 0.0, 0.0, 0.45723528614032366, 0.0, 0.0, 0.0, 0.0, 0.0, 0.0, 0.0, 0.0, 0.0, 0.0, 0.0, 0.0, 0.0, 0.0, 0.0, 0.0, 0.0, 0.0, 0.0, 0.0, 0.0, 0.0, 0.0]
['quel', 'criter', 'etre', 'accept']|Une pré-sélection se fait au cours de la 2eme ou 3eme année en fonction du dossier de l’étudiant. Ensuite, les étudiants éligibles à l’alternance disposent de quelques mois pour trouver un contrat qui doit être validé par l’école. L'admission au parcours alternance dépend aussi du nombre de places disponibles pour chaque majeur. |['quel criter etre accept']|[1, 0, 0, 0, 0, 0, 0, 0, 0, 0, 0, 0, 0, 0, 0, 0, 0, 0, 0, 0, 0, 1, 0, 0, 0, 0, 0, 0, 0, 0, 0, 0, 0, 0, 0, 0, 0, 1, 0, 0, 0, 0, 0, 0, 0, 0, 0, 0, 0, 0, 0, 0, 0, 0, 0, 0, 0, 0, 0, 0, 0, 1, 0, 0, 0, 0, 0, 0, 0, 0, 0, 0, 0, 0, 0, 0, 0]|[0.523749997093276, 0.0, 0.0, 0.0, 0.0, 0.0, 0.0, 0.0, 0.0, 0.0, 0.0, 0.0, 0.0, 0.0, 0.0, 0.0, 0.0, 0.0, 0.0, 0.0, 0.0, 0.523749997093276, 0.0, 0.0, 0.0, 0.0, 0.0, 0.0, 0.0, 0.0, 0.0, 0.0, 0.0, 0.0, 0.0, 0.0, 0.0, 0.523749997093276, 0.0, 0.0, 0.0, 0.0, 0.0, 0.0, 0.0, 0.0, 0.0, 0.0, 0.0, 0.0, 0.0, 0.0, 0.0, 0.0, 0.0, 0.0, 0.0, 0.0, 0.0, 0.0, 0.0, 0.4207823922580176, 0.0, 0.0, 0.0, 0.0, 0.0, 0.0, 0.0, 0.0, 0.0, 0.0, 0.0, 0.0, 0.0, 0.0, 0.0]
['cour', 'suiv', 'parcour', 'altern', 'mem', 'parcour', 'classiqu']|Non, il y a un socle de cours qui est commun à tous les parcours et qui est abordé pendant la période scolaire de la semaine et pendant le temps en entreprise, il y a des matières qui ne sont pas suivies par les alternants.  |['cour suiv parcour altern mem parcour classiqu']|[0, 0, 0, 1, 0, 0, 0, 0, 0, 0, 0, 0, 1, 0, 0, 0, 0, 0, 0, 0, 1, 0, 0, 0, 0, 0, 0, 0, 0, 0, 0, 0, 0, 0, 0, 0, 0, 0, 0, 0, 0, 0, 0, 0, 0, 0, 1, 0, 0, 0, 2, 0, 0, 0, 0, 0, 0, 0, 0, 0, 0, 0, 0, 0, 0, 0, 0, 0, 0, 0, 0, 0, 1, 0, 0, 0, 0]|[0.0, 0.0, 0.0, 0.20267445046945287, 0.0, 0.0, 0.0, 0.0, 0.0, 0.0, 0.0, 0.0, 0.39241227188140915, 0.0, 0.0, 0.0, 0.0, 0.0, 0.0, 0.0, 0.39241227188140915, 0.0, 0.0, 0.0, 0.0, 0.0, 0.0, 0.0, 0.0, 0.0, 0.0, 0.0, 0.0, 0.0, 0.0, 0.0, 0.0, 0.0, 0.0, 0.0, 0.0, 0.0, 0.0, 0.0, 0.0, 0.0, 0.3152652514177604, 0.0, 0.0, 0.0, 0.6305305028355208, 0.0, 0.0, 0.0, 0.0, 0.0, 0.0, 0.0, 0.0, 0.0, 0.0, 0.0, 0.0, 0.0, 0.0, 0.0, 0.0, 0.0, 0.0, 0.0, 0.0, 0.0, 0.39241227188140915, 0.0, 0.0, 0.0, 0.0]
